{
  "$schema": "https://json-schema.org/draft/2020-12/schema",
  "$id": "https://raw.githubusercontent.com/getsentry/MobileBuildMCP/main/schemas/structured-output/mobilebuildmcp.output.xcode-bridge-call-result/3.schema.json",
  "type": "object",
  "additionalProperties": false,
  "allOf": [
    {
      "$ref": "https://raw.githubusercontent.com/getsentry/MobileBuildMCP/main/schemas/structured-output/_defs/common.schema.json#/$defs/errorConsistency"
    }
  ],
  "$defs": {
    "relayedContentItem": {
      "type": "object",
      "additionalProperties": true,
      "properties": {
        "type": {
          "type": "string"
        }
      },
      "required": [
        "type"
      ]
    },
    "artifacts": {
      "type": "object",
      "additionalProperties": false,
      "properties": {
        "rawResponseJsonPath": {
          "type": "string"
        }
      },
      "required": [
        "rawResponseJsonPath"
      ]
    }
  },
  "properties": {
    "schema": {
      "const": "mobilebuildmcp.output.xcode-bridge-call-result"
    },
    "schemaVersion": {
      "const": "3"
    },
    "didError": {
      "type": "boolean"
    },
    "error": {
      "type": [
        "string",
        "null"
      ]
    },
    "data": {
      "type": "object",
      "additionalProperties": false,
      "properties": {
        "remoteTool": {
          "type": "string"
        },
        "succeeded": {
          "type": "boolean"
        },
        "content": {
          "type": "array",
          "items": {
            "$ref": "#/$defs/relayedContentItem"
          }
        },
        "artifacts": {
          "$ref": "#/$defs/artifacts"
        }
      },
      "required": [
        "remoteTool",
        "succeeded",
        "content"
      ]
    },
    "nextSteps": {
      "$ref": "https://raw.githubusercontent.com/getsentry/MobileBuildMCP/main/schemas/structured-output/_defs/common.schema.json#/$defs/nextSteps"
    }
  },
  "required": [
    "schema",
    "schemaVersion",
    "didError",
    "error",
    "data"
  ]
}
